<?xml version="1.0" encoding="UTF-8"?>

<!-- Valid elements within the <sidecar> element are:
     info - configuration file description
     radar - settings of the radar
     riu - configuration for the RIU (VME system)
     rib - configuration for the RIB control system
     dp - configuration for the data processing / recording system

     All SideCar processes will receive the same file, but they should just
     ignore the elements that they do not recognize or need.
  -->
<sidecar xmlns:xsi="http://www.w3.org/2001/XMLSchema-instance"
	 xsi:noNamespaceSchemaLocation="sidecar.xsd" version="1.0">

  <!-- Information about the configuration file 
       name - display name
       comments - commentary describing the configuration
    -->
  <info>
    <name>Sidecar Configuration 1.0.0 (DEV)</name>
    <comments>
  
    </comments>
  </info>

  <!-- Information about the radar being monitored
       name - radar name (needed?)
       rotationRate - number of rotations per minute
       beamWidth - how far the radar rotates while sampling one PRI (radians)
       shaftEncodingMax - the maximum shaft encoding value to expect
       gatesPerMessage - the maximum number of samples to expect in a PRI
       message
       rangeOfFirstGate - the range value associated with the first sample
       rangeDelta - the change in range between subsequent samples
    -->
  <radar>
    <name>Radar</name>
    <gateCountMax type="int">4684</gateCountMax>
    <shaftEncodingMax type="int">65535</shaftEncodingMax>
    <rotationRate units="rpm" type="double">6</rotationRate>
    <rangeMin units="km" type="double">0.0</rangeMin>
    <rangeMax units="km" type="double">300.0</rangeMax>
    <beamWidth units="radians" type="double">0.00125644</beamWidth>
    <latitude units="degrees" type="double">0.0</latitude>
    <longitude units="degrees" type="double">0.0</longitude>
    <height units="meters" type="double">0.0</height>
  </radar>

  <!-- Configuration of the Radar Interface Unit (RIU) VME system
    -->
  <riu> </riu>

  <!-- Configuration of the Radar Interface Box (RIB) PC-104 system.
    -->
  <rib> </rib>

  <!-- Configuration for the Data Processing (DP) DELL Blade systems. Contains
       host-specific items inside <host> tags. Note that this may also apply to
       the Data Recorder box if there is a <host> element with the name
       'data-recorder'

       The only valid element inside <dp> is <host>
    -->
  <dp recordingsDirectory="/tmp"
      loggerConfiguration="/opt/sidecar/builds/latest/data/logger.cfg">

    <!-- Configuration sample for a runner named 'sample.' The only valid
	 element in <runner> is <stream>. Each stream is made up of one or
	 more tasks with the following element names:

	 - vme: VME UDP connection
	 - multicast: VME Multicast UDP connection
	 - filein: message source that takes data from a file
	 - fileout: message sink that writes data to a file
	 - subscriber: message source that obtains data from a remote publisher
	 - publisher: message sink that publishes data to remote subscribers
	 - algorithm: a processing algorithm which may have one or more runtime
   	   parameter settings (<param> elements)
      -->
    
    <runner host="blade-1" name="Tracker" multicast="237.1.2.102">

      <stream name="Tracker">
    
       <subscriber name="track_maintainer_output" type="Track" channel="track_status_updates"/>
       <subscriber name="state_estimator_output" type="Track" channel="new_state_info"/>
       <subscriber name="track_initiator_output" type="Track" channel="new_tracks"/>
    
                <algorithm dll="ComposeExtractions">
                   <output type="Extractions" channel="ComposeExtractionsOut"/>                
                </algorithm>
    
        	<algorithm dll="DataAssociation">
        	  <input type="Extractions" name="extractions" channel="ComposeExtractionsOut"/>
        	  <input type="Track" name="track_status_updates" channel="track_status_updates"/>
                  <input type="Track" name="new_state_info" channel="new_state_info"/>
                  <input type="Track" name="new_tracks" channel="new_tracks"/>

        	  <output type="Extractions" name="unassoc_extractions" channel="unassoc_extractions"/>
                  <output type="Track" name="for_state_estimator" channel="for_state_estimator"/>
                  <output type="Track" name="corrected" channel="corrected"/>
        	  <param name="gateSizeMeters" type="int" value="2000"/>
                  <param name="secsPerProcessingSector" type="int" value="1"/>
                  <param name="assumedAltitude" type="double" value="7620.0"/>
                  <param name="alwaysUsingData" type="boolean" value="1"/>
        	</algorithm>

        	<algorithm dll="TrackInitiator">
        	  <input type="Extractions" channel="unassoc_extractions"/>
        	  <output type="Track" name="track_initiator_output" channel="track_initiator_output"/>
                  <param name="numScans" type="int" value="2"/>
                  <param name="searchRadius" type="double" value="5.0"/>
                  <param name="minRange" type="double" value="10.0" />
                  <param name="assumedAltitude" type="double" value="7620.0"/>
                  <param name="alwaysUsingData" type="boolean" value="1"/>
        	</algorithm>

                <publisher name="track_initiator_output" type="Track" channel="track_initiator_output"/>

        	<algorithm dll="StateEstimatorAB" name="StateEstimatorAB">
        	  <input type="Track" channel="for_state_estimator"/>
        	  <output type="Track" name="state_estimator_output" channel="state_estimator_output"/>
                  <param name="alpha" type="double" value="0.5"/>
                  <param name="beta" type="double" value="0.5"/>
                  <param name="assumedAltitude" type="double" value="7620.0"/>
                  <param name="alwaysUsingData" type="boolean" value="1"/>
        	</algorithm>        

                <publisher name="state_estimator_output" type="Track" channel="state_estimator_output"/>

                <algorithm dll="TrackMaintainer">
        	  <input type="Track" channel="corrected"/>
        	  <output type="Track" name="track_maintainer_output" channel="track_maintainer_output"/>
                  <param name="hitsBeforePromote" type="int" value="3"/>
                  <param name="missesBeforeDrop" type="int" value="3"/>
                  <param name="alwaysUsingData" type="boolean" value="1"/>
        	</algorithm>        
                
                <publisher name="track_maintainer_output" type="Track" channel="track_maintainer_output"/>


      </stream>

  

    </runner>

  </dp>

</sidecar>
